{
  "family_id": "07bdef65f3d440afbb7674e51fdaf48b",
  "fingerprint": "3d71a4dba039d599d40b666740d003677995fb91bf1bd06017e8598382193c5e",
  "lock_format": "flyology-wire-schema-lock",
  "lock_version": 1,
  "profile_id": 1,
  "root": {
    "fields": [
      {
        "presence": "required",
        "tag": 1,
        "value": {
          "construction_lower_bound": "1",
          "kind": "bytes",
          "maximum_octets": "16",
          "minimum_octets": "16"
        }
      },
      {
        "presence": "required",
        "tag": 2,
        "value": {
          "construction_lower_bound": "1",
          "kind": "bytes",
          "maximum_octets": "16",
          "minimum_octets": "16"
        }
      },
      {
        "presence": "required",
        "tag": 3,
        "value": {
          "kind": "unsigned",
          "maximum": "18446744073709551615",
          "minimum": "1"
        }
      },
      {
        "presence": "required",
        "tag": 4,
        "value": {
          "kind": "unsigned",
          "maximum": "18446744073709551615",
          "minimum": "1"
        }
      }
    ],
    "kind": "record",
    "reserved_tags": []
  },
  "schema_revision": 1
}
