{
  "family_id": "51000000000000000000000000000000",
  "fingerprint": "0081b2daedd5f36a30b65362dae48012f5d0e803800adbd8f233098d17dcb071",
  "lock_format": "flyology-wire-schema-lock",
  "lock_version": 1,
  "profile_id": 1,
  "root": {
    "fields": [
      {
        "presence": "required",
        "tag": 1,
        "value": {
          "kind": "unsigned",
          "maximum": "18446744073709551615",
          "minimum": "1"
        }
      },
      {
        "presence": "required",
        "tag": 2,
        "value": {
          "kind": "boolean"
        }
      },
      {
        "presence": "optional",
        "tag": 3,
        "value": {
          "construction_lower_bound": "1",
          "kind": "bytes",
          "maximum_octets": "1",
          "minimum_octets": "0"
        }
      }
    ],
    "kind": "record",
    "reserved_tags": []
  },
  "schema_revision": 3
}
