{
  "family_id": "52000000000000000000000000000000",
  "fingerprint": "a3e4e3563bc8dadeabd9e237a3a38cc0cab56debfbaa9b11b93ad7c55ecfdec8",
  "lock_format": "flyology-wire-schema-lock",
  "lock_version": 1,
  "profile_id": 1,
  "root": {
    "fields": [
      {
        "presence": "required",
        "tag": 1,
        "value": {
          "kind": "signed",
          "maximum": "7",
          "minimum": "-4"
        }
      },
      {
        "presence": "required",
        "tag": 2,
        "value": {
          "kind": "boolean"
        }
      }
    ],
    "kind": "record",
    "reserved_tags": []
  },
  "schema_revision": 1
}
